{
  "schema_version": "0.1-draft",
  "policy_kind": "pre_execution_gate_policy",
  "policy_version": "0.1",
  "fail_closed": true,
  "mandatory_evidence": [],
  "accepted_missing_evidence": [],
  "missing_evidence": [],
  "requested_dynamic_judgment": false,
  "limitation_severity": {
    "low": [
      "external scanner output format unverified",
      "Docker integration test not run"
    ],
    "medium": [
      "scanner unavailable",
      "scanner output parse failed",
      "commit binding missing",
      "dirty workspace binding",
      "content digest binding without commit"
    ],
    "high": [
      "runtime observer degraded",
      "runtime observer unavailable",
      "observer missing for requested dynamic judgment"
    ],
    "critical": [
      "expected commit mismatch",
      "approval mismatch",
      "raw output redaction incomplete",
      "raw output retained unknown",
      "policy violation that attempted execution without approval",
      "network allowed during target scan",
      "Docker socket mount",
      "host HOME mount",
      "credential mount"
    ]
  }
}
